{
  "schema_version": 1,
  "id": "make",
  "label": "Make",
  "description": "Makefile-driven build/test automation",
  "category": "tooling",
  "detection": {
    "files": ["Makefile", "makefile"],
    "globs": [],
    "commands": [],
    "scc_languages": ["Makefile"],
    "confidence": { "Makefile": 80, "makefile": 80, "scc:Makefile": 60 }
  },
  "version_checks": [
    { "id": "make", "tool": "make", "args": ["--version"], "required": false }
  ],
  "permission_overlays": { "language_overlays": ["make"], "extra_layers": [] },
  "project_context": { "primaryVerifyCommand": "make test" },
  "recommended_commands": { "test": "make test", "lint": "make lint" },
  "package_managers": [],
  "conflicts": [],
  "implies": [],
  "merge_priority": 40
}
