{
  "schema_version": 1,
  "id": "ruby",
  "label": "Ruby",
  "description": "Ruby / Bundler projects",
  "category": "language",
  "detection": {
    "files": ["Gemfile", "Gemfile.lock"],
    "globs": ["*.rb", "lib/**/*.rb"],
    "commands": [],
    "scc_languages": ["Ruby"],
    "confidence": { "Gemfile": 90, "Gemfile.lock": 70, "*.rb": 40, "lib/**/*.rb": 45, "scc:Ruby": 55 }
  },
  "version_checks": [
    { "id": "ruby", "tool": "ruby", "args": ["--version"], "required": false },
    { "id": "bundle", "tool": "bundle", "args": ["--version"], "required": false }
  ],
  "permission_overlays": { "language_overlays": ["ruby"], "extra_layers": [] },
  "project_context": { "primaryLanguage": "Ruby", "primaryRuntime": "Ruby", "packageManager": "bundler", "primaryTestCommand": "bundle exec rspec", "primaryVerifyCommand": "bundle exec rspec" },
  "recommended_commands": { "install": "bundle install", "test": "bundle exec rspec", "lint": "rubocop" },
  "package_managers": ["bundler"],
  "conflicts": [],
  "implies": ["markdown"],
  "merge_priority": 50
}
